{"event_schedule_version":"contextual-access-schedule-1.0.0","events":[{"custom_event_type":"urn:synthworld:event:contextual-device-posture-change:1.0","effective_tick":5,"event_id":"101117d5-ed68-5487-a6e0-8a7163dd0a9f","event_index":0,"native_fact_type":"device_posture","payload_family":"contextual_access_1_0","payload_sha256":"c49e03598a7a7b6bdc9f76243a11f9f19000fdbc61574b7080a245ddef184d07","profile_version":"synthworld-contextual-shared-signals-1.0.0","projected_event_tick":5,"schema_version":"1.0.0","standardized_caep_event_type":null,"subject_id":"be929c31-a661-5a99-8a46-6476529b89dd","synthetic":true},{"custom_event_type":"urn:synthworld:event:contextual-device-posture-change:1.0","effective_tick":5,"event_id":"29ff7032-58c9-5a0d-bc04-3099be0b19c3","event_index":1,"native_fact_type":"device_posture","payload_family":"contextual_access_1_0","payload_sha256":"df2577909ca4b3d8fd483a0188c433657e44e794749c9c3578feb73821072d27","profile_version":"synthworld-contextual-shared-signals-1.0.0","projected_event_tick":5,"schema_version":"1.0.0","standardized_caep_event_type":null,"subject_id":"a6aa20bc-c654-5c9b-ae00-f4b91df767e6","synthetic":true},{"custom_event_type":"urn:synthworld:event:contextual-risk-signal-change:1.0","effective_tick":5,"event_id":"300a784e-982e-52e1-9dc0-17a30668be7e","event_index":2,"native_fact_type":"risk_signal","payload_family":"contextual_access_1_0","payload_sha256":"cb0313025ffad1d49e167cce82580fc12ff7f7fc5c6616a3a4051cfce741d63e","profile_version":"synthworld-contextual-shared-signals-1.0.0","projected_event_tick":5,"schema_version":"1.0.0","standardized_caep_event_type":null,"subject_id":"be929c31-a661-5a99-8a46-6476529b89dd","synthetic":true},{"custom_event_type":"urn:synthworld:event:contextual-risk-signal-change:1.0","effective_tick":5,"event_id":"3138b0a7-f9e3-5e5d-a27b-77e18c588027","event_index":3,"native_fact_type":"risk_signal","payload_family":"contextual_access_1_0","payload_sha256":"bc87a0dbe6adec3209e14f82aa6f531df47d9b14b7fbed88157529936d7da892","profile_version":"synthworld-contextual-shared-signals-1.0.0","projected_event_tick":5,"schema_version":"1.0.0","standardized_caep_event_type":null,"subject_id":"27bec596-b170-53f1-9d25-8031a404dbb9","synthetic":true},{"custom_event_type":"urn:synthworld:event:contextual-case-assignment-change:1.0","effective_tick":5,"event_id":"3456fae8-ce0f-5ae0-84b3-70c435bde77c","event_index":4,"native_fact_type":"case_assignment","payload_family":"contextual_access_1_0","payload_sha256":"3d3942d77ffb484a09f6b3e814b8345c45b81942c0211c65b9bb96191f05652c","profile_version":"synthworld-contextual-shared-signals-1.0.0","projected_event_tick":5,"schema_version":"1.0.0","standardized_caep_event_type":null,"subject_id":"a0e8ab48-05ec-55c8-93df-c88969a62653","synthetic":true},{"custom_event_type":"urn:synthworld:event:contextual-case-assignment-change:1.0","effective_tick":5,"event_id":"396a39e6-8fcb-5da8-8f80-333dbffbbd61","event_index":5,"native_fact_type":"case_assignment","payload_family":"contextual_access_1_0","payload_sha256":"c6f69af49f1031a06027d26661daed2742bc9dd56c31a61d50ecb49922a6c94e","profile_version":"synthworld-contextual-shared-signals-1.0.0","projected_event_tick":5,"schema_version":"1.0.0","standardized_caep_event_type":null,"subject_id":"a0e8ab48-05ec-55c8-93df-c88969a62653","synthetic":true},{"custom_event_type":"urn:synthworld:event:contextual-risk-signal-change:1.0","effective_tick":6,"event_id":"53d80d09-3985-5789-924d-aaab315dfda2","event_index":6,"native_fact_type":"risk_signal","payload_family":"contextual_access_1_0","payload_sha256":"0e6b085e6b4c3f3056db1e27e5f03654904bae340f9759569500d01395d108eb","profile_version":"synthworld-contextual-shared-signals-1.0.0","projected_event_tick":6,"schema_version":"1.0.0","standardized_caep_event_type":null,"subject_id":"27bec596-b170-53f1-9d25-8031a404dbb9","synthetic":true}],"mapping_profile_digest":{"algorithm":"sha256","synthetic":true,"value":"d19dd35282817e118459dbaa5009ceb542676a8d80c0ecb1ce1b554b003f0af2"},"profile_version":"synthworld-contextual-shared-signals-1.0.0","schema_version":"1.0.0","selected_temporal_base":"synthworld-temporal-1.2.0","source_public_digest":{"algorithm":"sha256","synthetic":true,"value":"0f8cfa200263982b30a18569c3c8bc4a73626b6cf5d7fec024d27d3bb2e12601"},"synthetic":true}
